<?xml version="1.0" encoding="UTF-8"?>
<!--
  ~ template
  ~ Copyright (c) 2015, Alexey Romenskiy, All rights reserved.
  ~
  ~ This library is free software; you can redistribute it and/or
  ~ modify it under the terms of the GNU Lesser General Public
  ~ License as published by the Free Software Foundation; either
  ~ version 3.0 of the License, or (at your option) any later version.
  ~
  ~ This library is distributed in the hope that it will be useful,
  ~ but WITHOUT ANY WARRANTY; without even the implied warranty of
  ~ MERCHANTABILITY or FITNESS FOR A PARTICULAR PURPOSE.  See the GNU
  ~ Lesser General Public License for more details.
  ~
  ~ You should have received a copy of the GNU Lesser General Public
  ~ License along with this library.
  -->

<metamodel xmlns:xsi="http://www.w3.org/2001/XMLSchema-instance"
           xmlns="http://writeonce.codes/xsd/web-templating/1.0/metamodel"
           xsi:schemaLocation="http://writeonce.codes/xsd/web-templating/1.0/metamodel http://writeonce.codes/xsd/web-templating/1.0/metamodel.xsd">

    <template name="foo" abstract="true">
        <param name="" type="A"/>
    </template>
    <template name="qwe" extends="foo">
        <param name="" type="A"/>
    </template>
    <type name="X">
        <formatters default="">
            <formatter name=""/>
        </formatters>
    </type>
    <object name="A" abstract="true">
    </object>
    <object name="B" extends="A">
        <formatters default="">
            <formatter name=""/>
        </formatters>
        <attributes>
            <scalar name="" type=""/>
            <vector name="" type=""/>
        </attributes>
    </object>

</metamodel>